results/case_study_edge_semantics/relation_memory_semantic_evolution_summary.csv

dataset,task_name,relation_type,is_target_relation,first_epoch,last_epoch,first_pc1,first_pc2,last_pc1,last_pc2,direct_drift,path_length,norm_first,norm_last,norm_delta
aminer_paper,aminer_paper_citation_edge_inductive,author_coauthor_author,False,1,10,-1.111528992652893,-0.1363114118576049,-2.07698655128479,-0.1045754998922348,0.9659790192482115,1.9298981897558003,1.356863260269165,2.175119400024414,0.818256139755249
aminer_paper,aminer_paper_citation_edge_inductive,author_write_paper,False,1,10,1.4309890270233154,-1.3086150884628296,0.7087366580963135,-0.3935161828994751,1.1657849250114343,2.1768903064140184,2.336534261703491,1.364662528038025,-0.9718717336654663
aminer_paper,aminer_paper_citation_edge_inductive,paper_cite_paper,True,1,10,0.1044079065322876,-0.0650384575128555,-0.1304226815700531,0.1511271148920059,0.3191754373406772,1.0780371841250391,1.4992027282714844,0.9669562578201294,-0.532246470451355
aminer_paper,aminer_paper_citation_edge_inductive,paper_publish_venue,False,1,10,0.7153269648551941,1.0352535247802734,0.4124964773654938,1.0050965547561646,0.30432835391117363,2.2881814816584187,1.8821732997894287,1.618853211402893,-0.26332008838653564
aminer_paper,aminer_paper_citation_edge_transductive,author_coauthor_author,False,1,20,-1.4207472801208496,0.3989484310150146,-1.3330392837524414,-0.0850820764899253,0.49191282238060274,2.1533287468977225,2.299934864044189,1.7908073663711548,-0.5091274976730342
aminer_paper,aminer_paper_citation_edge_transductive,author_write_paper,False,1,20,0.7899762392044067,1.4733299016952517,0.3247527778148651,0.3830781579017639,1.1853614359645783,2.342796300931516,2.148491144180298,1.0113369226455688,-1.137154221534729
aminer_paper,aminer_paper_citation_edge_transductive,paper_cite_paper,True,1,20,-0.055195964872837,-0.0590125285089015,0.0697514340281486,-0.139871135354042,0.1488286491004303,1.8058950837044287,1.3552004098892212,0.8731836080551147,-0.48201680183410645
aminer_paper,aminer_paper_citation_edge_transductive,paper_publish_venue,False,1,20,0.9688117504119872,-0.7447550892829895,0.3674981594085693,-0.4403142929077148,0.6739897871800709,2.3087906196111763,1.979318618774414,1.161043405532837,-0.8182752132415771
dblp,dblp_edge_inductive,author_write_paper,False,1,9,-1.5901364088058472,-0.4511404931545257,-0.4721327722072601,0.5765640139579773,1.518587727260766,1.7639936722648548,2.452314615249634,1.3719254732131958,-1.080389142036438
dblp,dblp_edge_inductive,paper_cite_paper,True,1,9,1.2490437030792236,-0.4828376173973083,0.8225242495536804,0.1838429570198059,0.7914428801504638,1.796005388483957,2.03386664390564,1.3548624515533447,-0.6790041923522954
dblp,dblp_edge_transductive,author_write_paper,False,1,7,1.9156665802001955,0.4985057413578033,0.455920547246933,-0.371078759431839,1.6991279188855555,1.786091711179378,2.8363282680511475,1.625771164894104,-1.2105571031570435
dblp,dblp_edge_transductive,paper_cite_paper,True,1,7,-1.4341189861297607,0.2963859736919403,-1.2323933839797974,-0.0779849365353584,0.42526085757706583,0.9788724887868248,2.1563892364501958,1.681439757347107,-0.4749494791030888
patent_us,patent_us_edge_org_codeIII_inductive,org_codeIII,True,1,9,0.666442334651947,-0.8582335710525513,0.3754187822341919,-0.4545419216156006,0.49765616231186743,0.604119490592953,2.149454116821289,1.0734052658081057,-1.0760488510131834
patent_us,patent_us_edge_org_codeIII_inductive,org_coorg,False,1,9,-1.626751184463501,-0.0644272565841674,-1.6973161697387695,0.1183994561433792,0.19597199808559312,0.241221888697711,2.155153274536133,2.1618728637695312,0.0067195892333984375
patent_us,patent_us_edge_org_codeIII_inductive,patent_codeIII,False,1,9,0.8031280636787415,-0.5895049571990967,0.5385173559188843,-0.408839464187622,0.320404193209533,0.45603151245913365,2.0265228748321533,1.4863543510437012,-0.5401685237884521
patent_us,patent_us_edge_org_codeIII_inductive,patent_org,False,1,9,0.6983110308647156,1.1100125312805176,0.601898729801178,1.1532411575317385,0.10566004885449354,0.3638604955749143,1.86155104637146,1.7373896837234497,-0.12416136264801025
patent_us,patent_us_edge_org_codeIII_transductive,org_codeIII,True,1,8,0.5306838154792786,-0.9480754137039183,0.3610363602638244,-0.3612959384918213,0.6108112733007337,1.007194000220331,2.5456275939941406,1.112736463546753,-1.4328911304473877
patent_us,patent_us_edge_org_codeIII_transductive,org_coorg,False,1,8,-1.7174155712127686,-0.1509608179330825,-1.6951311826705933,0.080493040382862,0.23252415466363047,0.30155224181164986,2.202427387237549,2.1168859004974365,-0.0855414867401123
patent_us,patent_us_edge_org_codeIII_transductive,patent_codeIII,False,1,8,0.7910582423210144,-0.4695662260055542,0.7159242630004883,-0.4402951002120971,0.08063444458637782,0.72066045713336,2.116064071655273,1.6089109182357788,-0.5071531534194942
patent_us,patent_us_edge_org_codeIII_transductive,patent_org,False,1,8,0.4870904684066772,1.198842167854309,0.5107959508895874,1.2816356420516968,0.08612031856316525,0.28231381083742,1.8751873970031736,1.7538000345230105,-0.12138736248016313
thgl_software,thgl_software_edge_inductive,rel_0,False,1,9,-0.0699676200747489,0.9062629342079164,4.318668842315674,1.427519917488098,4.419484001740597,9.73245652708929,2.013648748397827,4.817248821258545,2.8036000728607178
thgl_software,thgl_software_edge_inductive,rel_1,False,1,9,0.1629119366407394,1.350455403327942,3.3847808837890625,2.1002039909362797,3.307954421877566,7.284677248359953,2.376293182373047,4.253318786621094,1.8770256042480469
thgl_software,thgl_software_edge_inductive,rel_10,False,1,9,0.7701574563980103,-1.0610620975494385,-1.1104447841644287,-1.9786897897720337,2.0925356314152053,8.122879076671785,2.6674718856811523,3.0744738578796387,0.40700197219848633
thgl_software,thgl_software_edge_inductive,rel_11,False,1,9,-1.4949177503585815,0.6990037560462952,-3.5995709896087646,-1.5057016611099243,3.0479979058267523,7.76910956510057,2.8448309898376465,4.431784629821777,1.5869536399841309
thgl_software,thgl_software_edge_inductive,rel_12,False,1,9,0.0356316119432449,-0.2335994839668274,-1.455168604850769,-2.0299808979034424,2.3344103047086624,7.299648206789586,2.200913667678833,3.3757026195526123,1.1747889518737793
thgl_software,thgl_software_edge_inductive,rel_13,False,1,9,-0.4647784531116485,0.444951981306076,-2.810725450515747,-1.6336026191711426,3.134303198765926,5.736420570371481,1.8606152534484863,3.591489553451538,1.7308743000030518
thgl_software,thgl_software_edge_inductive,rel_2,False,1,9,-0.1474307626485824,0.520577609539032,1.3379732370376587,-0.1041985005140304,1.6114497292738978,3.9809541284765895,2.2416117191314697,2.6719510555267334,0.43033933639526367
thgl_software,thgl_software_edge_inductive,rel_3,False,1,9,0.749043345451355,1.6632609367370603,5.476577281951904,1.650884032249451,4.727550138129587,12.691922191031306,2.775503873825073,6.107257843017578,3.3317539691925053
thgl_software,thgl_software_edge_inductive,rel_4,False,1,9,-0.0261820517480373,0.7634974122047424,3.3543334007263184,0.9742359519004822,3.387077716340591,7.06459937663559,1.888891577720642,4.019317626953125,2.130426049232483
thgl_software,thgl_software_edge_inductive,rel_5,False,1,9,0.2087742686271667,0.4156546890735626,2.2595534324646,-0.095547504723072,2.1135332648842446,4.97307279847082,2.2265422344207764,3.074782133102417,0.8482398986816406
thgl_software,thgl_software_edge_inductive,rel_6,True,1,9,-0.1193847134709358,0.2625332474708557,-1.9964076280593872,-2.1342709064483643,3.0443201497435437,9.109229856715869,2.3236892223358154,3.417379379272461,1.0936901569366455
thgl_software,thgl_software_edge_inductive,rel_7,False,1,9,-0.4544930160045624,-0.8539842367172241,-3.5484321117401123,-2.7432243824005127,3.6251465427182836,10.654903161799222,2.456186532974243,4.949819564819336,2.4936330318450928
thgl_software,thgl_software_edge_inductive,rel_8,False,1,9,-0.0624156631529331,0.5020037293434143,1.5347386598587036,-0.038895983248949,1.686260487171914,6.892957468335218,1.9431915283203125,2.330893278121948,0.3877017498016353
thgl_software,thgl_software_edge_inductive,rel_9,False,1,9,-1.3700114488601685,1.2869266271591189,-3.1139137744903564,-0.7488855719566345,2.680620568339894,10.07032030672476,2.9167320728302,3.711481809616089,0.7947497367858887
thgl_software,thgl_software_edge_transductive,rel_0,False,1,9,0.4239572584629059,-0.6971294283866882,-0.4453534781932831,-0.5926252603530884,0.8755696876903178,1.7975841587711485,1.980903148651123,1.848308086395264,-0.13259506225585915
thgl_software,thgl_software_edge_transductive,rel_1,False,1,9,-0.2415565848350525,0.5461318492889404,-1.0358315706253052,0.4760597646236419,0.797359925066119,2.2607178599142137,2.4008800983428955,2.11704158782959,-0.28383851051330566
thgl_software,thgl_software_edge_transductive,rel_10,False,1,9,-0.7731776833534241,-2.180305957794189,-0.7688367962837219,-2.448062896728516,0.26779212394697655,1.6527394792152252,2.691683769226074,2.650979518890381,-0.04070425033569336
thgl_software,thgl_software_edge_transductive,rel_11,False,1,9,0.1107066571712493,1.5645216703414917,0.1365675032138824,1.9229474067687988,0.3593574708997967,2.335325078192359,2.885819911956787,2.920220136642456,0.034400224685668945
thgl_software,thgl_software_edge_transductive,rel_12,False,1,9,-0.7913076281547546,-0.1265436559915542,-1.259103298187256,-0.9519034624099731,0.9487104926963794,2.934078522513121,2.242992877960205,2.6477246284484863,0.40473175048828125
thgl_software,thgl_software_edge_transductive,rel_13,False,1,9,-0.2448288053274154,0.5011053681373596,-0.7861664295196533,0.3690094947814941,0.5572214489085514,2.2858944066083544,1.900497555732727,1.7796070575714111,-0.12089049816131592
thgl_software,thgl_software_edge_transductive,rel_2,False,1,9,-0.0103866048157215,-0.5380308032035828,-0.3926829993724823,-0.4866638779640198,0.3857318943251457,1.485008048269128,2.1459240913391118,2.1141653060913086,-0.03175878524780318
thgl_software,thgl_software_edge_transductive,rel_3,False,1,9,0.8446686863899231,1.1105793714523315,-0.616926372051239,1.0707712173461914,1.462137067443734,3.6623206352075153,2.7446978092193604,2.5419671535491943,-0.20273065567016602
thgl_software,thgl_software_edge_transductive,rel_4,False,1,9,-0.017665147781372,0.7422560453414917,-0.5742067098617554,1.201079249382019,0.7212885988901312,2.864865599012864,1.838893294334412,2.5495684146881104,0.7106751203536983
thgl_software,thgl_software_edge_transductive,rel_5,False,1,9,0.6812594532966614,-0.9309269785881042,0.913525938987732,-0.7061434388160706,0.3232264842609989,2.6386316325887327,2.201376914978028,2.001327991485596,-0.20004892349243164
thgl_software,thgl_software_edge_transductive,rel_6,True,1,9,-0.0346316993236541,-0.3214209675788879,-0.806056022644043,-0.0458069071173667,0.8191816629627442,2.211674574976795,2.338741540908813,1.7117853164672852,-0.6269562244415279
thgl_software,thgl_software_edge_transductive,rel_7,False,1,9,-0.5189696550369263,-0.2441679835319519,0.4666054844856262,-0.2827663421630859,0.9863306691642091,4.325907024191366,2.5828423500061035,2.236588716506958,-0.3462536334991455
thgl_software,thgl_software_edge_transductive,rel_8,False,1,9,-0.7786593437194824,0.6366592049598694,-2.5481503009796143,0.4356386363506317,1.78087268405952,3.1402087830744057,2.0052413940429688,2.94411301612854,0.9388716220855713
thgl_software,thgl_software_edge_transductive,rel_9,False,1,9,2.026963949203491,-0.99755597114563,2.0247819423675537,0.472431868314743,1.4699894589129567,4.093303668156992,2.9272403717041016,3.2193315029144287,0.29209113121032715

results/case_study_edge_semantics/case_study_edge_semantics_zh.md

## 2. Relation Memory 是否体现语义演变

- `thgl_software_edge_inductive` 的目标关系 `rel_6` 在二维 relation-memory 空间中的路径长度为 `9.109`，首尾直线漂移为 `3.044`，范数变化为 `1.094`。
- `thgl_software_edge_transductive` 的目标关系 `rel_6` 在二维 relation-memory 空间中的路径长度为 `2.212`，首尾直线漂移为 `0.819`，范数变化为 `-0.627`。
- `aminer_paper_citation_edge_transductive` 的目标关系 `paper_cite_paper` 在二维 relation-memory 空间中的路径长度为 `1.806`，首尾直线漂移为 `0.149`，范数变化为 `-0.482`。
- `dblp_edge_inductive` 的目标关系 `paper_cite_paper` 在二维 relation-memory 空间中的路径长度为 `1.796`，首尾直线漂移为 `0.791`，范数变化为 `-0.679`。
- `aminer_paper_citation_edge_inductive` 的目标关系 `paper_cite_paper` 在二维 relation-memory 空间中的路径长度为 `1.078`，首尾直线漂移为 `0.319`，范数变化为 `-0.532`。
- `patent_us_edge_org_codeIII_transductive` 的目标关系 `org_codeIII` 在二维 relation-memory 空间中的路径长度为 `1.007`，首尾直线漂移为 `0.611`，范数变化为 `-1.433`。
- `dblp_edge_transductive` 的目标关系 `paper_cite_paper` 在二维 relation-memory 空间中的路径长度为 `0.979`，首尾直线漂移为 `0.425`，范数变化为 `-0.475`。
- `patent_us_edge_org_codeIII_inductive` 的目标关系 `org_codeIII` 在二维 relation-memory 空间中的路径长度为 `0.604`，首尾直线漂移为 `0.498`，范数变化为 `-1.076`。